{"artifact_status":"draft","authority_digest":"sha256:ee864ffdc060eb9a34e308f323d0fd9e852512f502ddda3114da844b25041f01","authority_id":"private-match-core-conformance","authority_version":"0.1","commit":"9bb59d3b5e1435885fdea60280d6602f937305c9","conformance_suite":{"complete_suite_tree_digest":"sha256:a85f3fb73190a26f8e048ab764ff5fd5f051f2a96047087a096c4ee194a8ab28","identifier":"private-match-core","semantic_digest":"sha256:83787c69ec1128eb9ba4b8dcdfcb4ae218674b6158cd8c6c573d898a6f72ceba","suite_manifest_file_digest":"sha256:268c6f3871d1a6b195bde36d514908cef37c97c9feff367cf8edb13dbb2b2cf7","suite_manifest_path":"conformance/suites/private-match-core-v0.1/suite-manifest.v0.1.json","suite_tree_manifest_file_digest":"sha256:4aca2688b495a85e6eb31df58a21ebe3aff4856c72a1c4b2a99874130184e3f3","suite_tree_manifest_path":"conformance/suites/private-match-core-v0.1/suite-tree-manifest.v0.1.json","version":"0.1"},"expected_results":{"file_digest":"sha256:6ace0b31a7583cbe5fa2c6edd5b26b2afbd50a9f9cc379478c1309d060d49137","path":"conformance/suites/private-match-core-v0.1/expected-results.v0.1.json","suite_digest":"sha256:83787c69ec1128eb9ba4b8dcdfcb4ae218674b6158cd8c6c573d898a6f72ceba"},"license":"Apache-2.0","limitations":["This authority binds reviewed public Protocol metadata and does not establish Protocol or Product correctness.","The pinned labels and digests are not runtime execution attestation and require a reviewed authority update when the Protocol changes."],"normative_oracle":{"file_digest":"sha256:6c8a215373be760c98430972e351cec88fb5fe960975bc8e0e9d8c6a7da2eefb","path":"conformance/source/normative-expected-results.v0.1.json"},"oracle_review":{"file_digest":"sha256:06cc331582f4dbd9fdc7df0274e55e6dc7b510dd214a1681d6aaa714df13e039","path":"conformance/source/evaluation-deadline-oracle-review.v0.1.json"},"protocol":{"artifact_path":"specs/state-machines/private-match-core-session-v0.1.yaml","identifier":"private-match-core","raw_file_digest":"sha256:3867508ec2584d377d000e2e2832c8a235818bf9e0fe6e9bb2de53099cc53f5f","semantic_digest":"sha256:32e514a61a83aeb1593623eb1144f323d1115dc8c812b5fd72af93a3ae06ba16","version":"0.1"},"repository":"itdojp/private-match-protocol","schema_version":"0.1"}
